{
  "$schema": "https://json-schema.org/draft/2020-12/schema",
  "title": "RuleManifest",
  "type": "object",
  "required": ["id", "name", "rule_kind", "content", "enforcement_mode", "status"],
  "properties": {
    "id": {"type": "string"},
    "name": {"type": "string"},
    "scope": {"type": "array", "items": {"type": "string"}},
    "namespace": {"type": "string"},
    "priority": {"type": "integer"},
    "rule_kind": {"type": "string"},
    "content": {"type": "string"},
    "applies_to": {"type": "array", "items": {"type": "string"}},
    "enforcement_mode": {
      "type": "string",
      "enum": ["block", "warn", "confirm", "annotate", "rank"]
    },
    "blocking": {"type": "boolean"},
    "evidence_refs": {"type": "array", "items": {"type": "string"}},
    "status": {"type": "string", "enum": ["active", "inactive", "deprecated"]},
    "owner_actor_id": {"type": ["string", "null"]},
    "created_at": {"type": "string"},
    "updated_at": {"type": "string"},
    "content_hash": {"type": "string"}
  },
  "additionalProperties": false
}
